preference_key,movie_title,star_cast,rating,year,place,vote,link
3,Cuenta conmigo,"Rob Reiner (dir.), Wil Wheaton, River Phoenix",8.042290709221579,1986,215,,/title/tt0092005/
4,Terminator,"James Cameron (dir.), Arnold Schwarzenegger, Linda Hamilton",8.041447753528919,1984,216,,/title/tt0088247/
1,En primera plana,"Tom McCarthy (dir.), Mark Ruffalo, Michael Keaton",8.03936818814177,2015,217,,/title/tt1895587/
2,Rush: Pasión y gloria,"Ron Howard (dir.), Daniel Brühl, Chris Hemsworth",8.039294287035107,2013,218,,/title/tt1979320/
3,Camino salvaje,"Sean Penn (dir.), Emile Hirsch, Vince Vaughn",8.03753199543735,2007,219,,/title/tt0758758/
4,Poder que mata,"Sidney Lumet (dir.), Faye Dunaway, William Holden",8.037157259829064,1976,220,,/title/tt0074958/
1,El mago de Oz,"Victor Fleming (dir.), Judy Garland, Frank Morgan",8.036056026730524,1939,221,,/title/tt0032138/
2,Logan: Wolverine,"James Mangold (dir.), Hugh Jackman, Patrick Stewart",8.035466441111359,2017,222,,/title/tt3315342/
3,Hechizo del tiempo,"Harold Ramis (dir.), Bill Murray, Andie MacDowell",8.032601281661075,1993,223,,/title/tt0107048/
4,Ratatouille,"Brad Bird (dir.), Brad Garrett, Lou Romano",8.03190737766761,2007,224,,/title/tt0382932/
1,El exorcista,"William Friedkin (dir.), Ellen Burstyn, Max von Sydow",8.028429255049488,1973,225,,/title/tt0070047/
2,Antes del atardecer,"Richard Linklater (dir.), Ethan Hawke, Julie Delpy",8.028309719920141,2004,226,,/title/tt0381681/
3,Lo mejor de nuestra vida,"William Wyler (dir.), Myrna Loy, Dana Andrews",8.026132556590706,1946,227,,/title/tt0036868/
4,Los increíbles,"Brad Bird (dir.), Craig T. Nelson, Samuel L. Jackson",8.025529681995481,2004,228,,/title/tt0317705/
1,Ser o no ser,"Ernst Lubitsch (dir.), Carole Lombard, Jack Benny",8.02482144506363,1942,229,,/title/tt0035446/
2,"Rebeca, una mujer inolvidable","Alfred Hitchcock (dir.), Laurence Olivier, Joan Fontaine",8.022663294827689,1940,230,,/title/tt0032976/
3,Viacrucis,"John Ford (dir.), Henry Fonda, Jane Darwell",8.022594210086096,1940,231,,/title/tt0032551/
4,La batalla de Argel,"Gillo Pontecorvo (dir.), Brahim Hadjadj, Jean Martin",8.02240829590681,1966,232,,/title/tt0058946/
1,Siempre a tu lado,"Lasse Hallström (dir.), Richard Gere, Joan Allen",8.021727762443398,2009,233,,/title/tt1028532/
2,La leyenda del indomable,"Stuart Rosenberg (dir.), Paul Newman, George Kennedy",8.021491721779032,1967,234,,/title/tt0061512/
3,Amores perros,"Alejandro G. Iñárritu (dir.), Emilio Echevarría, Gael García Bernal",8.020955095940401,2000,235,,/title/tt0245712/
4,Piratas del Caribe - La maldición del Perla Negra,"Gore Verbinski (dir.), Johnny Depp, Geoffrey Rush",8.018775934681527,2003,236,,/title/tt0325980/
1,Los 400 golpes,"François Truffaut (dir.), Jean-Pierre Léaud, Albert Rémy",8.016340766153212,1959,237,,/title/tt0053198/
2,La haine,"Mathieu Kassovitz (dir.), Vincent Cassel, Hubert Koundé",8.016065242423787,1995,238,,/title/tt0113247/
3,El pecado compartido,"Ingmar Bergman (dir.), Bibi Andersson, Liv Ullmann",8.015729071949712,1966,239,,/title/tt0060827/
4,Dersu Uzala,"Akira Kurosawa (dir.), Maksim Munzuk, Yuriy Solomin",8.015387622432511,1975,240,,/title/tt0071411/
1,La vida de Brian,"Terry Jones (dir.), Graham Chapman, John Cleese",8.014903619539513,1979,241,,/title/tt0079470/
2,Babam ve Oglum,"Cagan Irmak (dir.), Çetin Tekindor, Fikret Kuskan",8.014340344522097,2005,242,,/title/tt0476735/
3,Sucedió una noche,"Frank Capra (dir.), Clark Gable, Claudette Colbert",8.01360671669189,1934,243,,/title/tt0025316/
4,La novicia rebelde,"Robert Wise (dir.), Julie Andrews, Christopher Plummer",8.013513466702836,1965,244,,/title/tt0059742/
1,The Handmaiden,"Park Chan-wook (dir.), Kim Min-hee, Ha Jung-woo",8.009123315180961,2016,245,,/title/tt4016934/
2,Aladdín,"Ron Clements (dir.), Scott Weinger, Robin Williams",8.007049363426058,1992,246,,/title/tt0103639/
3,Gandhi,"Richard Attenborough (dir.), Ben Kingsley, John Gielgud",8.00667481321218,1982,247,,/title/tt0083987/
4,Jai Bhim,"T.J. Gnanavel (dir.), Suriya, Lijo Mol Jose",8.004720866446736,2021,248,,/title/tt15097216/
1,Historias cruzadas,"Tate Taylor (dir.), Emma Stone, Viola Davis",8.004692734469678,2011,249,,/title/tt1454029/
2,La bella y la bestia,"Gary Trousdale (dir.), Paige O'Hara, Robby Benson",8.003108163753858,1991,250,,/title/tt0101414/
