preference_key,movie_title,star_cast,rating,year,place,vote,link
1,Sueño de fuga,"Frank Darabont (dir.), Tim Robbins, Morgan Freeman",9.233863861334845,1994,1,,/title/tt0111161/
2,El padrino,"Francis Ford Coppola (dir.), Marlon Brando, Al Pacino",9.155892714846498,1972,2,,/title/tt0068646/
3,Batman: El Caballero de la Noche,"Christopher Nolan (dir.), Christian Bale, Heath Ledger",8.985513026758586,2008,3,,/title/tt0468569/
4,El padrino II,"Francis Ford Coppola (dir.), Al Pacino, Robert De Niro",8.984042028654047,1974,4,,/title/tt0071562/
1,12 hombres en pugna,"Sidney Lumet (dir.), Henry Fonda, Lee J. Cobb",8.947561115178942,1957,5,,/title/tt0050083/
2,La lista de Schindler,"Steven Spielberg (dir.), Liam Neeson, Ralph Fiennes",8.935275424173886,1993,6,,/title/tt0108052/
3,El señor de los anillos: El retorno del rey,"Peter Jackson (dir.), Elijah Wood, Viggo Mortensen",8.921146493000723,2003,7,,/title/tt0167260/
4,Tiempos violentos,"Quentin Tarantino (dir.), John Travolta, Uma Thurman",8.850703698040853,1994,8,,/title/tt0110912/
1,El señor de los anillos: La comunidad del anillo,"Peter Jackson (dir.), Elijah Wood, Ian McKellen",8.803665211135439,2001,9,,/title/tt0120737/
2," El bueno, el malo y el feo","Sergio Leone (dir.), Clint Eastwood, Eli Wallach",8.793676123796004,1966,1,,/title/tt0060196/
3,Forrest Gump,"Robert Zemeckis (dir.), Tom Hanks, Robin Wright",8.767309552623907,1994,11,,/title/tt0109830/
4,El club de la pelea,"David Fincher (dir.), Brad Pitt, Edward Norton",8.750026171277142,1999,12,,/title/tt0137523/
1,El origen,"Christopher Nolan (dir.), Leonardo DiCaprio, Joseph Gordon-Levitt",8.732913415300112,2010,13,,/title/tt1375666/
2,El señor de los anillos: Las dos torres,"Peter Jackson (dir.), Elijah Wood, Ian McKellen",8.727872609132527,2002,14,,/title/tt0167261/
3,El imperio contraataca,"Irvin Kershner (dir.), Mark Hamill, Harrison Ford",8.701789773140904,1980,15,,/title/tt0080684/
4,Matrix,"Lana Wachowski (dir.), Keanu Reeves, Laurence Fishburne",8.671103445683558,1999,16,,/title/tt0133093/
1,Buenos muchachos,"Martin Scorsese (dir.), Robert De Niro, Ray Liotta",8.651610195925633,1990,17,,/title/tt0099685/
2,Atrapado sin salida,"Milos Forman (dir.), Jack Nicholson, Louise Fletcher",8.641195821518812,1975,18,,/title/tt0073486/
3,"Seven, los siete pecados capitales","David Fincher (dir.), Morgan Freeman, Brad Pitt",8.603997985722245,1995,19,,/title/tt0114369/
4,Los siete samurais,"Akira Kurosawa (dir.), Toshirô Mifune, Takashi Shimura",8.5990224885489,1954,20,,/title/tt0047478/
1,¡Qué bello es vivir!,"Frank Capra (dir.), James Stewart, Donna Reed",8.596959420896338,1946,21,,/title/tt0038650/
2,El silencio de los inocentes,"Jonathan Demme (dir.), Jodie Foster, Anthony Hopkins",8.587986002842909,1991,22,,/title/tt0102926/
3,Ciudad de Dios,"Fernando Meirelles (dir.), Alexandre Rodrigues, Leandro Firmino",8.578886858552998,2002,23,,/title/tt0317248/
4,Rescatando al soldado Ryan,"Steven Spielberg (dir.), Tom Hanks, Matt Damon",8.577775871514392,1998,24,,/title/tt0120815/
1,La vida es bella,"Roberto Benigni (dir.), Roberto Benigni, Nicoletta Braschi",8.566008296050125,1997,25,,/title/tt0118799/
2,Milagros inesperados,"Frank Darabont (dir.), Tom Hanks, Michael Clarke Duncan",8.559786625839912,1999,26,,/title/tt0120689/
3,Interestelar,"Christopher Nolan (dir.), Matthew McConaughey, Anne Hathaway",8.555437647445244,2014,27,,/title/tt0816692/
4,La guerra de las galaxias,"George Lucas (dir.), Mark Hamill, Harrison Ford",8.554242724252816,1977,28,,/title/tt0076759/
1,Terminator 2: juicio final,"James Cameron (dir.), Arnold Schwarzenegger, Linda Hamilton",8.53507705529418,1991,29,,/title/tt0103064/
2,Volver al futuro,"Robert Zemeckis (dir.), Michael J. Fox, Christopher Lloyd",8.518148232772935,1985,30,,/title/tt0088763/
3,El viaje de Chihiro,"Hayao Miyazaki (dir.), Daveigh Chase, Suzanne Pleshette",8.51539902799323,2001,31,,/title/tt0245429/
4,Psicosis,"Alfred Hitchcock (dir.), Anthony Perkins, Janet Leigh",8.508809770522406,1960,32,,/title/tt0054215/
1,El pianista,"Roman Polanski (dir.), Adrien Brody, Thomas Kretschmann",8.5045273809312,2002,33,,/title/tt0253474/
2,El perfecto asesino,"Luc Besson (dir.), Jean Reno, Gary Oldman",8.50069035108846,1994,34,,/title/tt0110413/
3,Parásitos,"Bong Joon Ho (dir.), Song Kang-ho, Sun-kyun Lee",8.49556478633486,2019,35,,/title/tt6751668/
4,El rey león,"Roger Allers (dir.), Matthew Broderick, Jeremy Irons",8.48844867610661,1994,36,,/title/tt0110357/
1,Gladiador,"Ridley Scott (dir.), Russell Crowe, Joaquin Phoenix",8.485392593833131,2000,37,,/title/tt0172495/
2,Historia americana X,"Tony Kaye (dir.), Edward Norton, Edward Furlong",8.484525321182803,1998,38,,/title/tt0120586/
3,Sospechosos comunes,"Bryan Singer (dir.), Kevin Spacey, Gabriel Byrne",8.476354855324452,1995,39,,/title/tt0114814/
4,Los infiltrados,"Martin Scorsese (dir.), Leonardo DiCaprio, Matt Damon",8.475057603043764,2006,40,,/title/tt0407887/
1,El gran truco,"Christopher Nolan (dir.), Christian Bale, Hugh Jackman",8.468058963579223,2006,41,,/title/tt0482571/
2,Casablanca,"Michael Curtiz (dir.), Humphrey Bogart, Ingrid Bergman",8.46556574058555,1942,42,,/title/tt0034583/
3,Top Gun: Maverick,"Joseph Kosinski (dir.), Tom Cruise, Jennifer Connelly",8.46353859847353,2022,43,,/title/tt1745960/
4,Whiplash: Música y obsesión,"Damien Chazelle (dir.), Miles Teller, J.K. Simmons",8.460250167540252,2014,44,,/title/tt2582802/
1,Amigos intocables,"Olivier Nakache (dir.), François Cluzet, Omar Sy",8.453822929410224,2011,45,,/title/tt1675434/
2,Tiempos modernos,"Charles Chaplin (dir.), Charles Chaplin, Paulette Goddard",8.449729586709633,1936,46,,/title/tt0027977/
3,Harakiri,"Masaki Kobayashi (dir.), Tatsuya Nakadai, Akira Ishihama",8.448338251279432,1962,47,,/title/tt0056058/
4,Erase una vez en el oeste,"Sergio Leone (dir.), Henry Fonda, Charles Bronson",8.447826562217976,1968,48,,/title/tt0064116/
1,La tumba de las luciérnagas,"Isao Takahata (dir.), Tsutomu Tatsumi, Ayano Shiraishi",8.44764735550706,1988,49,,/title/tt0095327/
2,La ventana indiscreta,"Alfred Hitchcock (dir.), James Stewart, Grace Kelly",8.437339776170278,1954,50,,/title/tt0047396/
3,"Alien, el 8° pasajero","Ridley Scott (dir.), Sigourney Weaver, Tom Skerritt",8.435380396206407,1979,51,,/title/tt0078748/
4,Luces de la ciudad,"Charles Chaplin (dir.), Charles Chaplin, Virginia Cherrill",8.43426373877087,1931,52,,/title/tt0021749/
1,Cinema Paradiso,"Giuseppe Tornatore (dir.), Philippe Noiret, Enzo Cannavale",8.429190617874054,1988,53,,/title/tt0095765/
2,Amnesia,"Christopher Nolan (dir.), Guy Pearce, Carrie-Anne Moss",8.426000733275256,2000,54,,/title/tt0209144/
3,Apocalipsis,"Francis Ford Coppola (dir.), Martin Sheen, Marlon Brando",8.425177036044364,1979,55,,/title/tt0078788/
4,Los cazadores del arca perdida,"Steven Spielberg (dir.), Harrison Ford, Karen Allen",8.411797848267014,1981,56,,/title/tt0082971/
1,Django sin cadenas,"Quentin Tarantino (dir.), Jamie Foxx, Christoph Waltz",8.402695148626105,2012,57,,/title/tt1853728/
2,WALL·E,"Andrew Stanton (dir.), Ben Burtt, Elissa Knight",8.392614437466907,2008,58,,/title/tt0910970/
3,La vida de los otros,"Florian Henckel von Donnersmarck (dir.), Ulrich Mühe, Martina Gedeck",8.38631637120701,2006,59,,/title/tt0405094/
4,El ocaso de una vida,"Billy Wilder (dir.), William Holden, Gloria Swanson",8.382500983033166,1950,60,,/title/tt0043014/
1,La patrulla infernal,"Stanley Kubrick (dir.), Kirk Douglas, Ralph Meeker",8.37071342450678,1957,61,,/title/tt0050825/
2,El resplandor,"Stanley Kubrick (dir.), Jack Nicholson, Shelley Duvall",8.367862448801247,1980,62,,/title/tt0081505/
3,El gran dictador,"Charles Chaplin (dir.), Charles Chaplin, Paulette Goddard",8.366245646698241,1940,63,,/title/tt0032553/
4,Testigo de cargo,"Billy Wilder (dir.), Tyrone Power, Marlene Dietrich",8.356666299652508,1957,64,,/title/tt0051201/
1,Avengers: Infinity War,"Anthony Russo (dir.), Robert Downey Jr., Chris Hemsworth",8.355550576935473,2018,65,,/title/tt4154756/
2,"Alien 2, el regreso","James Cameron (dir.), Sigourney Weaver, Michael Biehn",8.344757002639845,1986,66,,/title/tt0090605/
3,Belleza americana,"Sam Mendes (dir.), Kevin Spacey, Annette Bening",8.337999357811654,1999,67,,/title/tt0169547/
4,Dr Insólito o Cómo aprendí a no preocuparme y amar la bomba,"Stanley Kubrick (dir.), Peter Sellers, George C. Scott",8.333776716035251,1964,68,,/title/tt0057012/
1,Batman: El caballero de la noche asciende,"Christopher Nolan (dir.), Christian Bale, Tom Hardy",8.328692873225474,2012,69,,/title/tt1345836/
2,Spider-Man: Un nuevo universo,"Bob Persichetti (dir.), Shameik Moore, Jake Johnson",8.328440403080174,2018,70,,/title/tt4633694/
3,Guasón,"Todd Phillips (dir.), Joaquin Phoenix, Robert De Niro",8.319904450668057,2019,71,,/title/tt7286456/
4,Oldboy: Cinco días para vengarse,"Park Chan-wook (dir.), Choi Min-sik, Yoo Ji-Tae",8.319838204435761,2003,72,,/title/tt0364569/
1,Corazón valiente,"Mel Gibson (dir.), Mel Gibson, Sophie Marceau",8.315521584274677,1995,73,,/title/tt0112573/
2,Amadeus,"Milos Forman (dir.), F. Murray Abraham, Tom Hulce",8.315378226470328,1984,74,,/title/tt0086879/
3,Toy Story,"John Lasseter (dir.), Tom Hanks, Tim Allen",8.31451712488218,1995,75,,/title/tt0114709/
4,Coco,"Lee Unkrich (dir.), Anthony Gonzalez, Gael García Bernal",8.312236079161652,2017,76,,/title/tt2380307/
1,El submarino,"Wolfgang Petersen (dir.), Jürgen Prochnow, Herbert Grönemeyer",8.311839181020575,1981,77,,/title/tt0082096/
2,Bastardos sin gloria,"Quentin Tarantino (dir.), Brad Pitt, Diane Kruger",8.310839325917955,2009,78,,/title/tt0361748/
3,La princesa Mononoke,"Hayao Miyazaki (dir.), Yôji Matsuda, Yuriko Ishida",8.303773175217197,1997,79,,/title/tt0119698/
4,Avengers: Endgame,"Anthony Russo (dir.), Robert Downey Jr., Chris Evans",8.301011326988887,2019,80,,/title/tt4154796/
1,Érase una vez en América,"Sergio Leone (dir.), Robert De Niro, James Woods",8.30074711091378,1984,81,,/title/tt0087843/
2,Mente indomable,"Gus Van Sant (dir.), Robin Williams, Matt Damon",8.286545793771783,1997,82,,/title/tt0119217/
3,Réquiem por un sueño,"Darren Aronofsky (dir.), Ellen Burstyn, Jared Leto",8.27691578591063,2000,83,,/title/tt0180093/
4,Toy Story 3,"Lee Unkrich (dir.), Tom Hanks, Tim Allen",8.27659025693338,2010,84,,/title/tt0435761/
1,Your Name,"Makoto Shinkai (dir.), Ryûnosuke Kamiki, Mone Kamishiraishi",8.274300488048018,2016,85,,/title/tt5311514/
2,Cantando bajo la lluvia,"Stanley Donen (dir.), Gene Kelly, Donald O'Connor",8.273822578527039,1952,86,,/title/tt0045152/
3,3 Idiots,"Rajkumar Hirani (dir.), Aamir Khan, Madhavan",8.26877483790269,2009,87,,/title/tt1187043/
4,El regreso del Jedi,"Richard Marquand (dir.), Mark Hamill, Harrison Ford",8.26814023140478,1983,88,,/title/tt0086190/
1,2001: odisea del espacio,"Stanley Kubrick (dir.), Keir Dullea, Gary Lockwood",8.265491458001451,1968,89,,/title/tt0062622/
2,Eterno resplandor de una mente sin recuerdos,"Michel Gondry (dir.), Jim Carrey, Kate Winslet",8.264693686536976,2004,90,,/title/tt0338013/
3,Perros de reserva,"Quentin Tarantino (dir.), Harvey Keitel, Tim Roth",8.264632312398039,1992,91,,/title/tt0105236/
4,Cielo e infierno,"Akira Kurosawa (dir.), Toshirô Mifune, Yutaka Sada",8.262933280307708,1963,92,,/title/tt0057565/
1,Cafarnaúm: la ciudad olvidada,"Nadine Labaki (dir.), Zain Al Rafeea, Yordanos Shiferaw",8.258763192325643,2018,93,,/title/tt8267604/
2,El ciudadano Kane,"Orson Welles (dir.), Orson Welles, Joseph Cotten",8.257988033893067,1941,94,,/title/tt0033467/
3,Lawrence de Arabia,"David Lean (dir.), Peter O'Toole, Alec Guinness",8.256445355750463,1962,95,,/title/tt0056172/
4,Jagten,"Thomas Vinterberg (dir.), Mads Mikkelsen, Thomas Bo Larsen",8.25497313583136,2012,96,,/title/tt2106476/
1,M el maldito,"Fritz Lang (dir.), Peter Lorre, Ellen Widmann",8.253888404854097,1931,97,,/title/tt0022100/
2,Intriga internacional,"Alfred Hitchcock (dir.), Cary Grant, Eva Marie Saint",8.253877581035713,1959,98,,/title/tt0053125/
3,De entre los muertos,"Alfred Hitchcock (dir.), James Stewart, Kim Novak",8.248066409353747,1958,99,,/title/tt0052357/
4, Amelie,"Jean-Pierre Jeunet (dir.), Audrey Tautou, Mathieu Kassovitz",8.246343633664964,2001,10,,/title/tt0211915/
1,Naranja mecánica,"Stanley Kubrick (dir.), Malcolm McDowell, Patrick Magee",8.244790275414854,1971,101,,/title/tt0066921/
2,Ven y mira,"Elem Klimov (dir.), Aleksey Kravchenko, Olga Mironova",8.243364090290465,1985,102,,/title/tt0091251/
3,Cara de guerra,"Stanley Kubrick (dir.), Matthew Modine, R. Lee Ermey",8.240230593548636,1987,103,,/title/tt0093058/
4,Pacto de sangre,"Billy Wilder (dir.), Fred MacMurray, Barbara Stanwyck",8.238005837822962,1944,104,,/title/tt0036775/
1,Piso de soltero,"Billy Wilder (dir.), Jack Lemmon, Shirley MacLaine",8.237068050271986,1960,105,,/title/tt0053604/
2,Caracortada,"Brian De Palma (dir.), Al Pacino, Michelle Pfeiffer",8.235154957043209,1983,106,,/title/tt0086250/
3,Ikiru - Vivir,"Akira Kurosawa (dir.), Takashi Shimura, Nobuo Kaneko",8.230410488451938,1952,107,,/title/tt0044741/
4,El golpe,"George Roy Hill (dir.), Paul Newman, Robert Redford",8.229095106455521,1973,108,,/title/tt0070735/
1,Matar a un ruiseñor,"Robert Mulligan (dir.), Gregory Peck, John Megna",8.228949544015899,1962,109,,/title/tt0056592/
2,Taxi Driver,"Martin Scorsese (dir.), Robert De Niro, Jodie Foster",8.228180172278398,1976,110,,/title/tt0075314/
3,Los Ángeles al desnudo,"Curtis Hanson (dir.), Kevin Spacey, Russell Crowe",8.224978348925596,1997,111,,/title/tt0119488/
4,"Up, una aventura de altura","Pete Docter (dir.), Edward Asner, Jordan Nagai",8.22432660822597,2009,112,,/title/tt1049413/
1,Fuego contra fuego,"Michael Mann (dir.), Al Pacino, Robert De Niro",8.223197914761217,1995,113,,/title/tt0113277/
2,Hamilton,"Thomas Kail (dir.), Lin-Manuel Miranda, Phillipa Soo",8.221652894872848,2020,114,,/title/tt8503618/
3,Metrópolis,"Fritz Lang (dir.), Brigitte Helm, Alfred Abel",8.220918779328736,1927,115,,/title/tt0017136/
4,Una separación,"Asghar Farhadi (dir.), Payman Maadi, Leila Hatami",8.220555949628329,2011,116,,/title/tt1832382/
1,Snatch: Cerdos y diamantes,"Guy Ritchie (dir.), Jason Statham, Brad Pitt",8.220538547642596,2000,117,,/title/tt0208092/
2,Duro de matar,"John McTiernan (dir.), Bruce Willis, Alan Rickman",8.220333562605198,1988,118,,/title/tt0095016/
3,La mujer que cantaba,"Denis Villeneuve (dir.), Lubna Azabal, Mélissa Désormeaux-Poulin",8.219535142703666,2010,119,,/title/tt1255953/
4,Indiana Jones y la última cruzada,"Steven Spielberg (dir.), Harrison Ford, Sean Connery",8.218451754195446,1989,120,,/title/tt0097576/
1,Ladrones de bicicletas,"Vittorio De Sica (dir.), Lamberto Maggiorani, Enzo Staiola",8.21764162180597,1948,121,,/title/tt0040522/
2,Spider-Man: sin camino a casa,"Jon Watts (dir.), Tom Holland, Zendaya",8.215001118118114,2021,122,,/title/tt10872600/
3,1917,"Sam Mendes (dir.), Dean-Charles Chapman, George MacKay",8.212230490217477,2019,123,,/title/tt8579674/
4,Like stars on Earth,"Aamir Khan (dir.), Darsheel Safary, Aamir Khan",8.205951333843611,2007,124,,/title/tt0986264/
1,La caída,"Oliver Hirschbiegel (dir.), Bruno Ganz, Alexandra Maria Lara",8.204653669952496,2004,125,,/title/tt0363163/
2,Por unos dólares más,"Sergio Leone (dir.), Clint Eastwood, Lee Van Cleef",8.203483533943952,1965,126,,/title/tt0059578/
3,Batman inicia,"Christopher Nolan (dir.), Christian Bale, Michael Caine",8.202258668975805,2005,127,,/title/tt0372784/
4,Dangal,"Nitesh Tiwari (dir.), Aamir Khan, Sakshi Tanwar",8.197649664431186,2016,128,,/title/tt5074352/
1,El chiquillo,"Charles Chaplin (dir.), Charles Chaplin, Edna Purviance",8.194408735865006,1921,129,,/title/tt0012349/
2,Una Eva y dos Adanes,"Billy Wilder (dir.), Marilyn Monroe, Tony Curtis",8.19149358461425,1959,130,,/title/tt0053291/
3,Everything Everywhere All at Once,"Dan Kwan (dir.), Michelle Yeoh, Stephanie Hsu",8.18685706459977,2022,131,,/title/tt6710474/
4,El Padre,"Florian Zeller (dir.), Anthony Hopkins, Olivia Colman",8.182746817320439,2020,132,,/title/tt10272386/
1,La malvada,"Joseph L. Mankiewicz (dir.), Bette Davis, Anne Baxter",8.18002921014054,1950,133,,/title/tt0042192/
2,Green Book: Una amistad sin fronteras,"Peter Farrelly (dir.), Viggo Mortensen, Mahershala Ali",8.174378208814304,2018,134,,/title/tt6966692/
3,El lobo de Wall Street,"Martin Scorsese (dir.), Leonardo DiCaprio, Jonah Hill",8.171405811766975,2013,135,,/title/tt0993846/
4,Juicio en Nuremberg,"Stanley Kramer (dir.), Spencer Tracy, Burt Lancaster",8.168616621321302,1961,136,,/title/tt0055031/
1,Los imperdonables,"Clint Eastwood (dir.), Clint Eastwood, Gene Hackman",8.164716165517657,1992,137,,/title/tt0105695/
2,Casino,"Martin Scorsese (dir.), Robert De Niro, Sharon Stone",8.163745761868851,1995,138,,/title/tt0112641/
3,Ran,"Akira Kurosawa (dir.), Tatsuya Nakadai, Akira Terao",8.16360348134585,1985,139,,/title/tt0089881/
4,El laberinto del fauno,"Guillermo del Toro (dir.), Ivana Baquero, Ariadna Gil",8.163413698856598,2006,140,,/title/tt0457430/
1,Petróleo sangriento,"Paul Thomas Anderson (dir.), Daniel Day-Lewis, Paul Dano",8.154855338615539,2007,141,,/title/tt0469494/
2,El sexto sentido,"M. Night Shyamalan (dir.), Bruce Willis, Haley Joel Osment",8.153755066629657,1999,142,,/title/tt0167404/
3,Una mente brillante,"Ron Howard (dir.), Russell Crowe, Ed Harris",8.153160981820816,2001,143,,/title/tt0268978/
4,Monty Python and the Holy Grail,"Terry Gilliam (dir.), Graham Chapman, John Cleese",8.152857815220877,1975,144,,/title/tt0071853/
1,The Truman Show: Historia de una vida,"Peter Weir (dir.), Jim Carrey, Ed Harris",8.151671426761917,1998,145,,/title/tt0120382/
2,Yojimbo,"Akira Kurosawa (dir.), Toshirô Mifune, Eijirô Tôno",8.148927102770012,1961,146,,/title/tt0055630/
3,El tesoro de la Sierra Madre,"John Huston (dir.), Humphrey Bogart, Walter Huston",8.147944251503727,1948,147,,/title/tt0040897/
4,La isla siniestra,"Martin Scorsese (dir.), Leonardo DiCaprio, Emily Mortimer",8.142785265874819,2010,148,,/title/tt1130884/
1,Rashomon,"Akira Kurosawa (dir.), Toshirô Mifune, Machiko Kyô",8.142736994979607,1950,149,,/title/tt0042876/
2,El gran escape,"John Sturges (dir.), Steve McQueen, James Garner",8.142416466208813,1963,150,,/title/tt0057115/
3,Parque jurásico,"Steven Spielberg (dir.), Sam Neill, Laura Dern",8.140589794167097,1993,151,,/title/tt0107290/
4,Kill Bill Vol 1,"Quentin Tarantino (dir.), Uma Thurman, David Carradine",8.137358289172786,2003,152,,/title/tt0266697/
1,Sin lugar para los débiles,"Ethan Coen (dir.), Tommy Lee Jones, Javier Bardem",8.135434965769809,2007,153,,/title/tt0477348/
2,Buscando a Nemo,"Andrew Stanton (dir.), Albert Brooks, Ellen DeGeneres",8.131246756511667,2003,154,,/title/tt0266543/
3,El hombre elefante,"David Lynch (dir.), Anthony Hopkins, John Hurt",8.13099634207585,1980,155,,/title/tt0080678/
4,El toro salvaje,"Martin Scorsese (dir.), Robert De Niro, Cathy Moriarty",8.129900319641198,1980,156,,/title/tt0081398/
1,Barrio Chino,"Roman Polanski (dir.), Jack Nicholson, Faye Dunaway",8.129328890792587,1974,157,,/title/tt0071315/
2,Lo que el viento se llevó,"Victor Fleming (dir.), Clark Gable, Vivien Leigh",8.126997235860124,1939,158,,/title/tt0031381/
3,V de Venganza,"James McTeigue (dir.), Hugo Weaving, Natalie Portman",8.12611415220448,2005,159,,/title/tt0434409/
4,Intensa Mente,"Pete Docter (dir.), Amy Poehler, Bill Hader",8.12460498218804,2015,160,,/title/tt2096673/
1,La cosa del otro mundo,"John Carpenter (dir.), Kurt Russell, Wilford Brimley",8.124567880875565,1982,161,,/title/tt0084787/
2,"Juegos, trampas y dos armas humeantes","Guy Ritchie (dir.), Jason Flemyng, Dexter Fletcher",8.123540472760633,1998,162,,/title/tt0120735/
3,Con M de Muerte,"Alfred Hitchcock (dir.), Ray Milland, Grace Kelly",8.119083423101511,1954,163,,/title/tt0046912/
4,El secreto de sus ojos,"Juan José Campanella (dir.), Ricardo Darín, Soledad Villamil",8.117862975293198,2009,164,,/title/tt1305806/
1,El puente sobre el río Kwai,"David Lean (dir.), William Holden, Alec Guinness",8.114494982369747,1957,165,,/title/tt0050212/
2,El increíble castillo vagabundo,"Hayao Miyazaki (dir.), Chieko Baishô, Takuya Kimura",8.114397138498873,2004,166,,/title/tt0347149/
3,Tres anuncios por un crimen,"Martin McDonagh (dir.), Frances McDormand, Woody Harrelson",8.111692229111812,2017,167,,/title/tt5027774/
4,La vida en el abismo,"Danny Boyle (dir.), Ewan McGregor, Ewen Bremner",8.111614150112578,1996,168,,/title/tt0117951/
1,Gran Torino,"Clint Eastwood (dir.), Clint Eastwood, Bee Vang",8.105354866919264,2008,169,,/title/tt1205489/
2,La última pelea,"Gavin O'Connor (dir.), Tom Hardy, Nick Nolte",8.105027144254832,2011,170,,/title/tt1291584/
3,"Fargo, secuestro voluntario","Joel Coen (dir.), William H. Macy, Frances McDormand",8.103412485012026,1996,171,,/title/tt0116282/
4,Mi vecino Totoro,"Hayao Miyazaki (dir.), Hitoshi Takagi, Noriko Hidaka",8.09540783664746,1988,172,,/title/tt0096283/
1,Intriga,"Denis Villeneuve (dir.), Hugh Jackman, Jake Gyllenhaal",8.09495339204327,2013,173,,/title/tt1392214/
2,Golpes del destino,"Clint Eastwood (dir.), Hilary Swank, Clint Eastwood",8.09004538587491,2004,174,,/title/tt0405159/
3,La quimera del oro,"Charles Chaplin (dir.), Charles Chaplin, Mack Swain",8.087890802467133,1925,175,,/title/tt0015864/
4,Blade Runner,"Ridley Scott (dir.), Harrison Ford, Rutger Hauer",8.087088298056788,1982,176,,/title/tt0083658/
1,Atrápame si puedes,"Steven Spielberg (dir.), Leonardo DiCaprio, Tom Hanks",8.086128489840219,2002,177,,/title/tt0264464/
2,Nido de ratas,"Elia Kazan (dir.), Marlon Brando, Karl Malden",8.084533753567174,1954,178,,/title/tt0047296/
3,El tercer hombre,"Carol Reed (dir.), Orson Welles, Joseph Cotten",8.082580863117013,1949,179,,/title/tt0041959/
4,Los niños del cielo,"Majid Majidi (dir.), Mohammad Amir Naji, Amir Farrokh Hashemian",8.080607600212629,1997,180,,/title/tt0118849/
1,Ben-Hur,"William Wyler (dir.), Charlton Heston, Jack Hawkins",8.078787969036823,1959,181,,/title/tt0052618/
2,12 años esclavo,"Steve McQueen (dir.), Chiwetel Ejiofor, Michael Kenneth Williams",8.078113328370318,2013,182,,/title/tt2024544/
3,El general,"Clyde Bruckman (dir.), Buster Keaton, Marion Mack",8.077596901244767,1926,183,,/title/tt0017925/
4,Perdida,"David Fincher (dir.), Ben Affleck, Rosamund Pike",8.077318164686737,2014,184,,/title/tt2267998/
1,Las fresas silvestres,"Ingmar Bergman (dir.), Victor Sjöström, Bibi Andersson",8.07726626381974,1957,185,,/title/tt0050986/
2,Antes del amanecer,"Richard Linklater (dir.), Ethan Hawke, Julie Delpy",8.076610649664643,1995,186,,/title/tt0112471/
3,El francotirador,"Michael Cimino (dir.), Robert De Niro, Christopher Walken",8.075867218040145,1978,187,,/title/tt0077416/
4,Harry Potter y las reliquias de la muerte 2,"David Yates (dir.), Daniel Radcliffe, Emma Watson",8.075754296464988,2011,188,,/title/tt1201607/
1,En el nombre del padre,"Jim Sheridan (dir.), Daniel Day-Lewis, Pete Postlethwaite",8.074292187161543,1993,189,,/title/tt0107207/
2,El gran hotel Budapest,"Wes Anderson (dir.), Ralph Fiennes, F. Murray Abraham",8.07243323919638,2014,190,,/title/tt2278388/
3,Caballero sin espada,"Frank Capra (dir.), James Stewart, Jean Arthur",8.07123710518837,1939,191,,/title/tt0031679/
4,El salario del miedo,"Henri-Georges Clouzot (dir.), Yves Montand, Charles Vanel",8.070036090914403,1953,192,,/title/tt0046268/
1,Barry Lyndon,"Stanley Kubrick (dir.), Ryan O'Neal, Marisa Berenson",8.069473746467166,1975,193,,/title/tt0072684/
2,Sherlock Jr,"Buster Keaton (dir.), Buster Keaton, Kathryn McGuire",8.06905287589623,1924,194,,/title/tt0015324/
3,Salinui chueok,"Bong Joon Ho (dir.), Song Kang-ho, Kim Sang-kyung",8.06831829031664,2003,195,,/title/tt0353969/
4,Room,"Lenny Abrahamson (dir.), Brie Larson, Jacob Tremblay",8.06750911572186,2015,196,,/title/tt3170832/
1,Hasta el último hombre,"Mel Gibson (dir.), Andrew Garfield, Sam Worthington",8.067134355100421,2016,197,,/title/tt2119532/
2,Klaus,"Sergio Pablos (dir.), Jason Schwartzman, J.K. Simmons",8.066766515566657,2019,198,,/title/tt4729430/
3,El séptimo sello,"Ingmar Bergman (dir.), Max von Sydow, Gunnar Björnstrand",8.066268296411572,1957,199,,/title/tt0050976/
4,Relatos salvajes,"Damián Szifron (dir.), Darío Grandinetti, María Marull",8.064729803478299,2014,200,,/title/tt3011894/
1,Identidad peligrosa,"Joel Coen (dir.), Jeff Bridges, John Goodman",8.062839272831516,1998,201,,/title/tt0118715/
2,Cómo entrenar a tu dragón,"Dean DeBlois (dir.), Jay Baruchel, Gerard Butler",8.061968826754038,2010,202,,/title/tt0892769/
3,Mad Max: Furia en el camino,"George Miller (dir.), Tom Hardy, Charlize Theron",8.06174159134297,2015,203,,/title/tt1392190/
4,Mary and Max,"Adam Elliot (dir.), Toni Collette, Philip Seymour Hoffman",8.060298757788638,2009,204,,/title/tt0978762/
1,"Monsters, Inc","Pete Docter (dir.), Billy Crystal, John Goodman",8.058489064147187,2001,205,,/title/tt0198781/
2,Tiburón,"Steven Spielberg (dir.), Roy Scheider, Robert Shaw",8.057876872110517,1975,206,,/title/tt0073195/
3,La passion de Jeanne dArc,"Carl Theodor Dreyer (dir.), Maria Falconetti, Eugene Silvain",8.055495911945302,1928,207,,/title/tt0019254/
4,Hotel Ruanda,"Terry George (dir.), Don Cheadle, Sophie Okonedo",8.052958395401207,2004,208,,/title/tt0395169/
1,La sociedad de los poetas muertos,"Peter Weir (dir.), Robin Williams, Robert Sean Leonard",8.05229805351642,1989,209,,/title/tt0097165/
2,Tôkyô monogatari,"Yasujirô Ozu (dir.), Chishû Ryû, Chieko Higashiyama",8.05193556343487,1953,210,,/title/tt0046438/
3,Pather Panchali,"Satyajit Ray (dir.), Kanu Bannerjee, Karuna Bannerjee",8.051787527089088,1955,211,,/title/tt0048473/
4,Pelotón,"Oliver Stone (dir.), Charlie Sheen, Tom Berenger",8.047400601024503,1986,212,,/title/tt0091763/
1,Rocky,"John G. Avildsen (dir.), Sylvester Stallone, Talia Shire",8.04737806661881,1976,213,,/title/tt0075148/
2,Contra lo imposible,"James Mangold (dir.), Matt Damon, Christian Bale",8.045764897954234,2019,214,,/title/tt1950186/
